i,isbn,title,subtitle,authors,publishedDate,pageCount,maturityRating,language,textSnippet,description,categories,thumbnail
258,9782100789429,Quantix,La physique quantique et la relativité en BD,Laurent Schafer,2019-03-06,176.0,NOT_MATURE,fr,,"La physique moderne décrit un monde étrange, incompréhensible pour la plupart d'entre nous. Temps, espace, matière et énergie n'existent pas vraiment, nous vivons dans un monde en trompe-l'oeil. Découvrez cette réalité cachée en suivant les aventures rigolotes d'une famille très ordinaire et partez à la rencontre de ces chercheurs dont les idées ont révolutionné notre vision du réel : Einstein, Schrödinger, Bohr...",,
259,9782348080272,Rendre le monde indisponible,,Hartmut Rosa,2023-09-07,0.0,NOT_MATURE,fr,,,,
260,2080711857,Les mythes de Platon,anthologie,Platon,2004,278.0,NOT_MATURE,fr,,"Rassemble les mythes issus des ""Dialogues"" qui réunissent trois caractéristiques : ils décrivent des moeurs, des manières de vivre en un temps et un lieu déterminés et s'adressent à la communauté civique dans son ensemble.","Mythology, Greek",
261,,Controverses ; et Suasoires /,,,,,,,,,,
262,3515021183,Antiquitates rerum divinarum /,,,,,,,,,,
263,225100453X,Progymnasmata /,,,,,,,,,,
264,,Controverses ; et Suasoires /,,,,,,,,,,
265,9782251339696,Les cultes isiaques dans le monde gréco-romain,,Laurent Bricault,2013,0.0,NOT_MATURE,fr,,"English summary: The Egyptian cult of Isis and her family was one of the most successful and widespread of the ancient world. This richly illustrated collection presents hundreds of documents and objects, translated and discussed, that have furthered our understanding of the impact of Isis on the Greco-Roman world. French description: La diffusion, dans l'ensemble du Bassin mediterraneen et meme au-dela (en Arabie, en Inde et dans la lointaine Bretagne), du culte de plusieurs divinites originaires d'Egypte (Isis et son paredre Sarapis, leur fils le petit Harpocrate, Anubis le dieu chacal, Apis le buf de Memphis, Osiris meme) est l'un des phenomenes les plus remarquables des epoques hellenistique et romaine. Longtemps assise sur quelques textes litteraires, de belles inscriptions grecques et latines, d'imposantes statues de Rome, d'Athenes ou d'ailleurs, notre comprehension de l'accueil reserve par les non-Egyptiens a cette divine famille s'est considerablement approfondie et affinee par l'etude et l'analyse de milliers de documents sortis de terre depuis la Renaissance (bijoux, statuettes, papyrus, ceramiques, monnaies). On trouvera dans le present recueil, richement illustre, plusieurs centaines de ces documents traduits le cas echeant en francais et commentes, revelant l'extraordinaire impact qu'eurent les cultes isiaques sur les populations du monde greco-romain pres de huit siecles durant.",Greece,http://books.google.com/books/content?id=lVkRlQEACAAJ&printsec=frontcover&img=1&zoom=1&source=gbs_api
266,2877721841,Isis,mère des dieux,Françoise Dunand,2000,206.0,NOT_MATURE,fr,,"La plus populaire des déesses d'Egypte, Isis, doit sa première renommée à la résurrection d'Osiris, quand elle reconstitua le corps du dieu et conçut de lui son fils Horus. Considérée comme une grande magicienne, Isis protège les enfants et représente l'épouse fidèle. Souvent représentée en train d'allaiter, elle est avant tout la Mère. Ce qui lui assura son énorme succès et fit que les Grecs puis les Romains l'adoptèrent. Ils lui prêtèrent des vertus d'abondance, et des temples lui furent dédiés dans tout l'Empire, en Gaule, en Espagne, sur le Rhin et le Danube. Son imagerie et certains de ses attributs se retrouveront dans le culte marial.",Isis (Divinité égyptienne),
267,2877541568,Corpus,,Laurent Bricault,2005,158.0,NOT_MATURE,fr,,"Les différentes recherches menées depuis une trentaine d'années pour une connaissance plus approfondie et une meilleure compréhension de la diffusion des cultes isiaques dans le monde gréco-romain ont fait apparaître le besoin de disposer d'un nouveau corpus épigraphique, tant les publications se sont multipliées depuis le début des années 1970. Le présent recueil, avec ses 1771 inscriptions isiaques traduites et commentées, double le nombre de celles publiées par Ladislav Vidman en 1969 dans sa précieuse Sylloge Inscriptionum Religionis Isiacae et Sarapiacae (SIRIS) et offre en outre aux lecteurs un fort volume de 135 planches. Des index très détaillés devraient permettre en outre d'ouvrir de nombreuses pistes de recherches. Avec ces trois volumes, chercheurs confirmés et étudiants disposent désormais d'un instrument de travail qui marque une étape décisive pour l'approche d'un secteur neuf de l'étude de la culture antique. Celui-ci s'inscrit au coeur d'une «trilogie isiaque» due au même auteur et publiée dans les Mémoires de l'Académie, comprenant l'Atlas de la diffusion des cultes isiaques (Mémoires t. XXIII) paru en 2001, ainsi que la Sylloge Nummorum Religionis Isiacae et Sarapiacae (Mémoires t. XXXVIII) paru en 2008.",History,http://books.google.com/books/content?id=CL8TAQAAMAAJ&printsec=frontcover&img=1&zoom=1&source=gbs_api
268,2738107583,Fin de la plainte (La),,François Roustang,2000,260.0,NOT_MATURE,fr,,"Que cherche un patient qui vient voir un thérapeute ? Il s’épanche, il se plaint, il dit vouloir changer. Mais comment faire ? C’est la question que se pose tout thérapeute, et aussi chacun de nous, dès qu’il est confronté à une grande douleur, à une perte, dès qu’il en a assez. Comment faire ? Gémir, ruminer, récriminer ? Chercher une écoute, une consolation pour mieux patauger dans nos ""problèmes"" ? Non, répond François Roustang. Il faut au contraire en finir avec la plainte, sortir de notre moi chéri, que nous cultivons à coups de jérémiades. À cette condition, nous pourrons vraiment refondre notre existence pour nous ouvrir enfin au monde et aux autres. Philosophe et psychanalyste de formation, praticien original, François Roustang est sans doute celui qui s’interroge avec le plus de force critique sur le sens et l’effet des thérapies. Il est l’auteur de plusieurs ouvrages désormais classiques, comme Un destin si funeste, Qu’est-ce que l’hypnose ? et Comment faire rire un paranoïaque ?",Social Science,http://books.google.com/books/content?id=eR1ZcPD5MNwC&printsec=frontcover&img=1&zoom=1&edge=curl&source=gbs_api
269,,"Oeuvres / Poésies de jeunesse, poésies diverses ... ;",,,,,,,,,,
270,9782070134168,Œuvres poétiques et dramatiques,,Charles Péguy,2014,1894.0,NOT_MATURE,fr,,"La postérité retient parfois de Péguy l efficacité du polémiste, le prophétisme du philosophe de l Histoire, le moraliste aigu, l anarchiste irréductible ou le socialiste humaniste et, d une manière peu discutée, le patriote martyr. Mais le poète, le connaît-on vraiment? La répétition est l arme, redoutable, de sa versification. Elle ne produit pas de radotage. C est le martèlement d une voix adressée au public que Péguy entend, en quelque sorte, réinventer; et c est sans doute aussi la marque d une scansion, qui rejoint la part d oralité consubstantielle à presque toute poésie. Henri Meschonnic écrivait de celle de Péguy qu elle était une ±épopée de la voix». Elle est simple, sans affectation. Si Du Bellay et Corneille sont des modèles, Villon n est jamais très loin. -- Publisher.",,http://books.google.com/books/content?id=8EPvU_4aqVgC&printsec=frontcover&img=1&zoom=1&source=gbs_api
271,9782070114863,Œuvres romanesques complètes,I,"Gilles Philippe, Georges Bernanos",2015,1301.0,NOT_MATURE,fr,,"Le premier roman de Bernanos, Sous le soleil de Satan, paraît en 1926. Au jeune Malraux qui lui fait part de son enthousiasme, Gide rétorque : ""cette chose m'est contraire"". C'est que ""Bernanos mettait brutalement en question tout ce que ""l'Europe la plus cultivée"" pensait de la création romanesque"", se souvient Malraux en 1974. Cette ""heureuse négligence"" des lois du roman a pu déconcerter : ""Si l'on dit de Georges Bernanos qu'il fut le plus grand romancier de son temps, nul n'est surpris ; mais nul n'est convaincu"". Elle est aussi ce qui confère à ses récits leur intemporalité. Les romanciers français de l'entre-deux-guerres intéressent peu Bernanos. Il ne leur ressemble pas. S'il fallait l'inscrire dans une lignée, ce serait celle de Dostoïevski. Sombres, véhéments, paroxystiques, en un mot expressionnistes, ses romans sont des écrits de combat au même titre que ses essais. La complaisance n'est pas son fort. Il ne ménage rien ni personne, et surtout pas les tièdes. ""Ô vous, qui ne connûtes jamais du monde que des couleurs et des sons sans substance, cours sensibles, bouches lyriques où l'âpre vérité fondrait comme une praline - petits cours, petites bouches - ceci n'est point pour vous"" (Sous le soleil de Satan). La langue même est exigeante. Elle tire le lecteur du côté du sacré. Le sacré, le surnaturel, la grâce, le mal ne sont pas des accessoires chez Bernanos. Ils sont au centre du projet romanesque. Et pourtant - Malraux l'agnostique en témoigne -, nul besoin de partager la foi de l'auteur pour être sensible au tragique du monde déchu qu'habitent ses personnages. Nous sommes parfois devenus aveugles, c'est vrai, à des allusions scripturaires qui étaient autrefois évidentes. Mais à cet aveuglement partiel les romans de Bernanos gagnent une imprévisibilité, une étrangeté qui conduisent, une fois encore, du côté de Dostoïevski. L'ouvre nous parle différemment, mais toujours aussi fortement. Cette ouvre, l'heure est venue de la rééditer en ne négligeant rien des documents accessibles à qui sait les découvrir, et en n'hésitant pas à revenir sur des traditions éditoriales qui ont entraîné des habitudes de lecture. En 1934, une partie d'Un crime avait été refusée par Plon. On vient de retrouver le manuscrit écarté. Publié ici pour la première fois, il permet aussi d'établir un meilleur texte pour Un mauvais rêve, roman né du refus partiel d'Un crime et resté inédit du vivant de l'auteur. Autre ouvrage posthume, et célébrissime, Dialogues des carmélites : on en propose une édition qui fait clairement apparaître l'état du manuscrit laissé par Bernanos à sa mort (1948). Pour les romans publiés par l'écrivain, on est revenu aux particularités des éditions parues de son vivant, y compris pour Monsieur Ouine, jusqu'alors disponible dans une version augmentée en 1955 ; les pages ajoutées à cette date figurent désormais à leur place : en appendice - comme de nombreux autres documents, extraits de manuscrits,",,
272,9782204094467,Le problème de l'empathie /,,,,,,,,,,
273,9782080426635,Œuvres complètes /,,,,,,,,,,
274,2082107108,La religion gnostique : le message du Dieu étranger et les débuts du christianisme /,,,,,,,,,,
275,9782070113330,Écrits gnostiques,La bibliothèque de Nag Hammadi,"Jean-Pierre Mahé, Paul-Hubert Poirier",2007,1930.0,NOT_MATURE,fr,,"L'intégralité des textes retrouvés à Nag Hammadi en 1945 comporte douze livres reliés et plusieurs feuillets d'un treizième, soit 1.200 pages de papyrus. Cette bibliothèque gnostique rassemble des apocalypses, des Evangiles et actes apocryphes, des dialogues de révélation, des homélies, ainsi que plusieurs écrits gnomiques, ascétiques ou hermétiques.",Gnostic literature,http://books.google.com/books/content?id=sU0RAQAAIAAJ&printsec=frontcover&img=1&zoom=1&source=gbs_api
276,9782842420758,L'art d'avoir toujours raison ou Dialectique éristique /,,,,,,,,,,
277,9782910386146,L'obsolescence de l'homme,sur l'âme à l'époque de la deuxième révolution industrielle (1956),Günther Anders,2002,360.0,NOT_MATURE,fr,,""" Tout le monde est d'une certaine manière occupé et employé comme travailleur à domicile. Un travailleur à domicile d'un genre pourtant très particulier. Car c'est en consommant la marchandise de masse - c'est-à-dire grâce à ses loisirs - qu'il accomplit sa tâche, qui consiste à se transformer lui-même en homme de masse. Alors que le travailleur à domicile classique fabriquait des produits pour s'assurer un minimum de biens de consommation et de loisirs, celui d'aujourd'hui consomme au cours de ses loisirs un maximum de produits pour, ce faisant, collaborer à la production des hommes de masse. Le processus tourne même résolument au paradoxe puisque le travailleur à domicile, au lieu d'être rémunéré pour sa collaboration, doit au contraire lui-même la payer, c'est-à-dire payer les moyens de production dont l'usage fait de lui un homme de masse (l'appareil et, le cas échéant, dans de nombreux pays, les émissions elles-mêmes). Il paie donc pour se vendre. Sa propre servitude, celle-là même qu'il contribue à produire, il doit l'acquérir en l'achetant puisqu'elle est, elle aussi, devenue une marchandise. "" "" Le monde comme fantôme et comme matrice """,,
278,9782262041892,Histoire du Japon médiéval,le monde à l'envers,Pierre-François Souyri,2013-08-22,522.0,NOT_MATURE,fr,,"A travers l'ascension des samouraïs et la naissance d'une société guerrière qu'on a pu qualifier de féodale, ce livre nous plonge dans les temps troubles du Moyen Age japonais (XIIe-XVIe siècle). Pierre-François Souyri montre l'importance des conflits sociaux qui déchirèrent le pays, la poussée des classes populaires, les diversités régionales, l'émergence, enfin, de nouvelles formes culturelles à l'origine du Japon ""traditionnel"". Chemin faisant, il éclaire la dynamique d'une société fondamentalement instable que les chroniqueurs contemporains désignaient comme ""un monde à l'envers"".",Japan,
279,9782251381169,Le salaire de la destruction,formation et ruine de l'économie nazie,Adam Tooze,2012,812.0,NOT_MATURE,fr,,"Presentation de l'editeur: Certains livres sont appeles a demeurer sans equivalent, depassant tout ce que l'on a pu lire sur un sujet. Le Salaire de la destruction, une histoire economique du IIIe Reich, est l'un d'eux, tant pour le nombre d'idees recues qu'il balaye que pour les conclusions inedites et l'approche globale qu'il propose.La catastrophe de 1939-1945 est-elle nee de la puissance implacable de l'Allemagne nazie ou bien a-t-elle ete precipitee par ses faiblesses economiques? Captivant, unanimement reconnu, fruit des recherches d'un historien au sommet de son art, cet ouvrage capital donne un poids nouveau et central a l'economie dans la politique de conquete mondiale elaboree par Hitler.Diplome de King's College (Cambridge) et de la London School of Economics, Adam Tooze enseigne l'histoire de l'Allemagne a Yale. Il a deja publie Statistics and the German State, 1900-1945: The Making of Modern Economic Knowledge (Cambridge University Press, 2001",Business & Economics,
280,9782213637785,Comment le peuple juif fut inventé,de la Bible au sionisme,Shlomo Sand,2008,446.0,NOT_MATURE,fr,,"Quand le peuple juif fut-il créé ? Est-ce il y a quatre mille ans, ou bien sous la plume d'historiens juifs du XIXe siècle qui ont reconstitué rétrospectivement un peuple imaginé afin de façonner une nation future ? Dans le sillage de la "" contre-histoire "" née en Israël dans les années 1990, Shlomo Sand nous entraîne dans une plongée à travers l'histoire "" de longue durée "" des juifs. Les habitants de la Judée furent-ils exilés après la destruction du Second Temple, en l'an 70 de l'ère chrétienne, ou bien s'agit-il ici d'un mythe chrétien qui aurait infiltré la tradition juive ? Et, si les paysans des temps anciens n'ont pas été exilés, que sont-ils devenus ? L'auteur montre surtout comment, à partir du XIXe siècle, le temps biblique a commencé à être considéré par les premiers sionistes comme le temps historique, celui de la naissance d'une nation. Ce détour par le passé conduit l'historien à un questionnement beaucoup plus contemporain : à l'heure où certains biologistes israéliens cherchent encore à démontrer que les juifs forment un peuple doté d'un ADN spécifique, que cache aujourd'hui le concept d'"" Etat juif "", et pourquoi cette entité n'a-t-elle pas réussi jusqu'à maintenant à se constituer en une république appartenant à l'ensemble de ses citoyens, quelle que soit leur religion ? En dénonçant cette dérogation profonde au principe sur lequel se fonde toute démocratie moderne, Shlomo Sand délaisse le débat historiographique pour proposer une critique de la politique identitaire de son pays. Construit sur une analyse d'une grande originalité et pleine d'audace, cet ouvrage foisonnant aborde des questions qui touchent autant à l'origine historique des juifs qu'au statut civique des Israéliens. Paru au printemps 2008 en Israël, il y est très rapidement devenu un best-seller et donne encore lieu à des débats orageux.",Israel,
281,9782897125684,Je suis Ariel Sharon,,Yara El-Ghadban,2018-09,130.0,NOT_MATURE,fr,,"Tel Aviv, 4 janvier 2006. Le premier ministre Ariel Sharon sombre dans le coma. Il demeure inconscient huit ans jusquà sa mort en 2014. Que se passe-t-il dans la tête de Sharon ? Le roman donne corps et voix à un chur de femmes, Véra, Gali, Lily, Rita, qui le mettent face à ses horreurs et à son humanité. Elles le guident vers la lumière quand les ombres de la mort lassaillent.",,http://books.google.com/books/content?id=_xZDugEACAAJ&printsec=frontcover&img=1&zoom=1&source=gbs_api
282,2915547203,L'invention de la tradition,,"Eric J. Hobsbawm, Terence O. Ranger",2006,370.0,NOT_MATURE,fr,,"Depuis sa parution en anglais, L'Invention de la tradition n'a pas cessé d'être cité et commenté, en Grande-Bretagne comme ailleurs. Le concept de "" tradition inventée "" fait aujourd'hui partie du patrimoine des sciences sociales et de l'histoire. Les différentes études réunies dans ce recueil décrivent comment les Etats-nations modernes en gestation, mais aussi les mouvements anti-systémiques qui se développèrent en leur sein et les sociétés dites "" traditionnelles "", ont délibérément cherché, souvent avec succès, à réinterpréter radicalement ou à inventer, parfois de toutes pièces, des traditions et des "" contre-traditions "" pour se légitimer, s'inscrire dans la longue durée, assurer la cohésion de la communauté ou encore garantir le contrôle des métropoles impériales sur les sujets coloniaux.",,
283,2701189675,La vie électrique,Histoire et imaginaire (XVIIIe-XXIe siècle),"Alain Beltran, Patrice Carré",2016-10-11,400.0,NOT_MATURE,fr,,,,
284,9782876731202,La grande chasse aux sorcières en Europe aux débuts des temps modernes,,Brian P. Levack,1991,284.0,NOT_MATURE,fr,,"""Entre 1450 et 1750 à travers l'Europe, 100000 personnes furent persécutées par des tribunaux séculiers et ecclésiastiques pour crime de sorcellerie et culte rendu au diable"". Cet ouvrage évoque et tente d'expliquer cette situation. [SDM].",Witchcraft,http://books.google.com/books/content?id=ptRKFvOtHs8C&printsec=frontcover&img=1&zoom=1&source=gbs_api
285,9780300246759,Seeing Like a State,How Certain Schemes to Improve the Human Condition Have Failed,James C. Scott,2020-03-17,462.0,NOT_MATURE,en,,"""One of the most profound and illuminating studies of this century to have been published in recent decades.""--John Gray, New York Times Book Review Hailed as ""a magisterial critique of top-down social planning"" by the New York Times, this essential work analyzes disasters from Russia to Tanzania to uncover why states so often fail--sometimes catastrophically--in grand efforts to engineer their society or their environment, and uncovers the conditions common to all such planning disasters. ""Beautifully written, this book calls into sharp relief the nature of the world we now inhabit.""--New Yorker ""A tour de force.""-- Charles Tilly, Columbia University",Political Science,http://books.google.com/books/content?id=Qe_RDwAAQBAJ&printsec=frontcover&img=1&zoom=1&edge=curl&source=gbs_api
286,9780141033570,"Thinking, Fast and Slow",,Daniel Kahneman,2011,609.0,NOT_MATURE,en,,Psychologist Daniel Kahneman reveals the truth about our intuitions and rationality to teach us how to better our lives. He explores the fascinating flaws and marvels of human behaviour and reveals to us the common errors in people's beliefs.,Business & Economics,http://books.google.com/books/content?id=AV9x8XakdV0C&printsec=frontcover&img=1&zoom=1&source=gbs_api
287,9782889011827,Le siècle d'Emma,une famille suisse dans les turbulences du XXe siècle,Eric Burnand,2020,207.0,NOT_MATURE,fr,,"Un fiancé perdu dans les violences de la grève générale, un frère qui devient espion pour l'Allemagne nazie, le passage clandestin de la frontière pour l'amour d'une saisonnière italienne et l'engagement d'une squatteuse féministe et antinucléaire... L'histoire d'Emma et de sa famille nous plonge dans les turbulences, les espoirs et les désillusions du XXe siècle en Suisse.",,
288,9782348073168,La nuit de noces,Une histoire de l'intimité conjugale,Aïcha Limbada,2023-09-07,0.0,NOT_MATURE,fr,,,,
289,9782901000709,Le grand vide,,Léa Murawiec,2021,0.0,NOT_MATURE,fr,,"""Mais... Manel Naher, c'est moi !"" Qui est donc cette autre Manel Naher, qui fait la Une des journaux ? Elle fait de l’ombre à Manel Naher, la vraie Manel Naher, l'héroïne de cette histoire ! Elle ne se rend pas compte qu’elle la met en danger, la vraie Manel Naher, en ayant tout ce succès ? Vous comprenez, si tout le monde se met à penser à cette Manel Naher qui devient célèbre, au lieu de penser à Manel Naher, qui passe ses journées au fond d'une petite librairie... eh bien : on risque de l’oublier, notre Manel. Et dans ce monde, si l’on ne pense plus à vous, alors vous mourrez, tout simplement. Penser à quelqu'un, c'est lui donner de la Présence. L'horizon, ici, est barré par les milliers de noms qui s'affichent de toutes parts, et les mendiants ne quémandent qu'une seconde d'attention... Survivre pour certains, devenir Immortel pour d'autres : c'est la Présence qui fait tourner cette ville tentaculaire. Manel, elle, tournerait volontiers le dos à tout ça ; mais là-bas, au-delà des gratte-ciels, il n'y a que le Grand Vide, d'où personne n'est jamais revenu...","Comic books, strips, etc",http://books.google.com/books/content?id=lRWazgEACAAJ&printsec=frontcover&img=1&zoom=1&source=gbs_api
290,9782355221156,Techno-féodalisme,Critique de l'économie numérique,Cédric Durand,2020-09-17,256.0,NOT_MATURE,fr,,,,
291,9782344045664,Bobigny 1972,,Marie Bardiaux-Vaïente,2024-01-10,0.0,NOT_MATURE,fr,,,,
292,9782330030223,"De toutes les nuits, les amants",,Mieko Kawakami,2014,278.0,NOT_MATURE,fr,,"Fuyuko a trente-quatre ans, correctrice elle travaille en free-lance pour l'édition, vit seule et ne s'imagine aucune relation affective. Elle ne se nourrit pas de ses lectures : elle décortique les mots, cherche la faute cachée, l'erreur embusquée. Elle n'écrit pas, ne connaît pas la musique, s'habille sans la moindre recherche. Mais Fuyuko aime la lumière. Elle ne sort la nuit qu'au soir de ses anniversaires en hiver, seule, pour voir et pour compter les lumières dans ce froid qu'on peut presque entendre si l'on tend l'oreille, dans cet air sec et aride mais quelque part fertile. Timide, introvertie, Fuyuko va néanmoins laisser entrer deux personnes aux abords de sa vie : Hijiri, son interlocutrice professionnelle, et M Mitsutsuka, un professeur de physique qui lui offre un accès d'une autre dimension vers la lumière : le bleu a une longueur d'onde très courte, elle se diffuse facilement, c'est pourquoi le ciel apparaît si vaste. Voyage au pays de l'apparente légèreté des femmes, de leurs peurs minuscules ou béantes, de leurs renoncements et de leurs excès, de leurs choix et de leurs libertés, ce livre est d'une gravité toute poétique et d'une modernité absolue. Il convoque et défie tous les a priori et vibre, riche et puissant, d'utopies scintillantes et de rêves oubliés.",,
293,9782100839315,La confiance créative,tous innovateurs avec le Design Thinking,"Tom Kelley, David Kelley",2022,0.0,NOT_MATURE,fr,,"La 4e de couv. indique : ""Les frères Kelley, figures leaders de l'innovation, ont déjà révélé le pouvoir du Design Thinking à des milliers d'étudiants de l'Université de Stanford et à des centaines d'entrepreneurs à travers le monde. Aujourd'hui, c'est à vous qu'ils offrent l'opportunité de faire entrer le pouvoir de la confiance créative dans votre vie et/ou dans votre entreprise. Dans ce livre illustré de nombreux exemples, ils montrent que nous sommes tous - individus ou organisations - capables de faire preuve d'innovation si nous apprenons à nous faire confiance à l'aide d'un puissant outil : le Design Thinking Cette approche s'applique à la compréhension et la résolution d'un problème quel qu'il soit : l'optimisation ou la création d'un produit, d'un service ou d'un environnement, la transformation d'une organisation ou encore la conduite d'un projet. Trop souvent, nous pensons que l'innovation est l'apanage de certains esprits dits « créatifs ». Or, savoir innover, être créatif, est un état d'esprit qui se travaille avec le sourire et en équipe, et qui change un projet, le monde et la vie.""",,
294,9782889086153,Dix petites souris,,"Colin-Thibert, Haydé Ardalan",2022,0.0,NOT_MATURE,fr,,"Avez-vous déjà vu dix petites souris s'en aller à Paris ? Après la lecture de ce tout-carton, ce sera chose faite...ou presque ! Bien que pleines de bonne volonté, les dix petites héroïnes auront de la peine à mener leur voyage à terme. Chacune d'elles semble avoir une bonne raison pour abandonner le reste de la troupe : la pluie décourage Marceline, les bruits effraient Ernestine, ou encore Sabine réalise qu'elles ne partent pas au ski mais bien à Paris. L'une d'elles réussira-t-elle à se rendre à Paris ? [éditeur]",,
