i,isbn,title,subtitle,authors,publishedDate,pageCount,maturityRating,language,textSnippet,description,categories,thumbnail
0,9782871303336,Classification décimale universelle,édition abrégée,UDC Consortium (The Hague),2012,449.0,NOT_MATURE,fr,,,,
1,9782278058327,Les interactions dans l'enseignement des langues,agir professoral et pratiques de classe,Francine Cicurel,2011,287.0,NOT_MATURE,fr,,"C'est dans l'interaction en classe que s'actualise l'action d'un enseignant mais elle s'édifie également au sein de contextes éducatifs et de cultures éducatives variés. Cette étude vise à mieux faire comprendre comment les pratiques de transmission se construisent dans l'enseignement des langues. Elle met en lumière l'importance à accorder aux intentions d'agir, aux motifs de l'action enseignante, aux répertoires didactiques des enseignants. A partir d'observations d'interactions en classes de langue et de paroles d'enseignants sur leur action, ce livre introduit à l'agir professoral, entendu comme l'ensemble des actions verbales et non verbales que met en place un professeur pour transmettre et communiquer des savoirs. L'ouvrage est conçu pour que les enseignants et les futurs enseignants découvrent leur propre culture professorale, une culture où coexistent principes, croyances, désirs, expériences, idéalisations.",Interaction analysis in education,
2,2343190194,Histoire de vie et recherche biographique,perspectives sociohistoriques,"Aneta Slowik, Hervé Breton, Gaston Pineau",2020,311.0,NOT_MATURE,fr,,"Depuis la parution en 1918 de l'ouvrage fondateur The Polish Peasant in Europe and America : Monograph of an Immigrant Group de William Thomas et Florian Znaniecki, un puissant courant de recherche s'est déployé à partir des récits de vie. La vitalité de ce paradigme est réfléchie selon différentes perspectives sociohistoriques dans cet ouvrage qui comporte trois parties. La première est l'occasion d'un retour sur les sources des approches narratives et biographiques dans le champ des sciences humaines et sociales, depuis les premiers travaux de Thomas et Znaniecki et de l'École de Chicago. La seconde est dédiée aux approches (auto)biographiques mobilisées dans les domaines de la recherche, de l'intervention et de la formation, tandis que la troisième est plus spécifiquement dédiée aux recherches qui mobilisent le récit et les histoires de vie, en s'intéressant notamment aux phénomènes de compréhension générés par le récit. Au gré des chapitres, le lecteur pourra percevoir et comprendre la diversité et la cohérence des courants, approches et terrains de la recherche qui mobilisent les méthodes biographiques et narratives. Ce livre collectif est le produit d'une recherche internationale sur la vitalité historique des approches narratives et biographiques. Il résulte également de deux colloques scientifiques qui ont été organisés en 2018 : Vitalités des approches biographiques (Université de Basse-Silésie à Wroclaw, Pologne) et Les sciences sociales à l'épreuve du terrain. Logique d'enquête, approches narratives et dynamiques coopératives depuis l'école de Chicago (Université de Tours, France). Il s'inscrit aussi dans la dynamique de réseaux associatifs de recherche-formation : ASIHVIF (Association internationale des Histoires de vie et Recherche Biographique en Éducation) et Biograph (Associação Brasileira de Pesquisa (Auto) Biográfica).",Narrative inquiry (Research method),http://books.google.com/books/content?id=Q2PMDwAAQBAJ&printsec=frontcover&img=1&zoom=1&edge=curl&source=gbs_api
3,9782365350020,"Ce livre devrait me permettre de résoudre le conflit au Proche-Orient, d'avoir m",,Sylvain Mazas,2012-06-07,200.0,NOT_MATURE,fr,,,,
4,9782702180815,Le grand monde,Les années glorieuses,Pierre Lemaitre,2022,586.0,NOT_MATURE,fr,,"Trois histoires d'amour, un lanceur d'alerte, une adolescente égarée, deux processions, Bouddha et Confucius, un journaliste ambitieux, une mort tragique, le chat Joseph, une épouse impossible, le retour du passé, un parfum d'exotisme, une passion soudaine et irrésistible. Et quelques meurtres",French literature,http://books.google.com/books/content?id=f5u3zgEACAAJ&printsec=frontcover&img=1&zoom=1&source=gbs_api
5,9782353450428,100 idées pour mieux gérer les troubles de l’attention avec ou sans hyperactivité (TDA/H),,Francine Lussier,2013-02-11,176.0,NOT_MATURE,fr,,"Chaque jour, les parents et les enseignants sont confrontés aux problèmes que posent ces enfants inattentifs, impulsifs et hyperactifs. 100 idées pour comprendre les enjeux de ce trouble et organiser un environnement favorable. 100 idées qui constitueront une aide pertinente et concrète pour survivre à l’essoufflement que parents et enseignants ressentent lorsqu’ils sont aux prises avec l’enfant ou l’adolescent qui souffre d’un TDA/H (trouble du déficit d’attention avec ou sans hyperactivité), diagnostiqué ou non. Francine LUSSIER, docteur en neuropsychologie de l'Université de Montréal, neuropsychologue clinicienne à l'hôpital Sainte-Justine, a fondé le Centre d'Évaluation Neuropsychologique et d'Orientation Pédagogique (CÉNOP) en 1994. Elle est également l'autreur nombreux ouvrage, dont Mon enfant est difficile, chez le même éditeur.",Education,
6,9782100806614,La boîte à outils des formateurs,,"Fabienne Bouchut, Frédérique Cuisiniez, Isabelle Cauden, Jonathan Tronchet",2020-05-27,200.0,NOT_MATURE,fr,,,,
7,9782710121152,L'autorité éducative dans la classe,Douze situations pour apprendre à l'exercer,Bruno Robbes,2010,265.0,NOT_MATURE,fr,,"Tout enseignant, tout éducateur se doit d'exercer une autorité. Aucun d'entre eux, d'ailleurs, ne souhaite délibérément abdiquer son autorité ! Pour autant, les injonctions à la "" restauration "" de l'autorité traditionnelle paraissent bien dérisoires dès lors qu'elles ne s'accompagnent ni d'une réflexion sur la nature de cette autorité, ni d'un travail sur les moyens de l'exercer à bon escient. L'ouvrage de Bruno Robbes rompt tout autant avec les lamentations passéistes sur un âge d'or de l'autorité qu'avec les préconisations simplistes sur "" la tenue de classe "". L'auteur s'efforce, en revanche, de comprendre comment une autorité peut être véritablement éducative. Il souligne la nécessité de dépasser l'opposition entre contrainte et liberté afin de construire des situations où l'élève consent à s'impliquer dans ce qui lui est proposé pour accéder aux savoirs qui lui permettront de s'émanciper. Il montre aussi que cette autorité requiert une éthique professionnelle qui la rend, tout à la fois, légitime et praticable. Mais l'originalité de ce livre tient aussi dans la manière dont il s'appuie sur des situations concrètes qui, de la maternelle au lycée, permettent de comprendre où se situent les problèmes d'autorité, comment les analyser et les surmonter. Grâce à ces situations, où l'on reconnaîtra le quotidien de notre école, le lecteur pourra non seulement identifier les enjeux de l'autorité éducative aujourd'hui, mais aussi voir comment on peut concrètement s'y prendre pour y faire face. Sans dramatiser ni s'épuiser. Et même en trouvant du plaisir à enseigner ! Philippe Meirieu",,
8,9791097160821,Un autre regard sur le climat,,Emma,2019-05-02,96.0,NOT_MATURE,fr,,"Une bande-dessinée inédite par la blogueuse la plus engagée du moment ! Elle avait déjà servi la cause des femmes et des réfugiés. La blogueuse Emma s'attaque maintenant au réchauffement climatique. Comment fonctionne le réchauffement climatique ? Qu'est-ce que la taxe carbone ? S'appuyant sur de nombreuses recherches, cette introduction au changement climatique permet de mieux comprendre les mécanismes à l'oeuvre et les évolutions possibles dans les décennies à venir. Le but est aussi de montrer que des solutions sont à portée de main et que chacun à notre manière, nous pouvons contribuer à ce changement. Des dessins simples, un contenu au plus près des préoccupations des citoyens et un message clair : se trouvent ici condensés tous les ingrédients qui font le succès des bandes-dessinées d'Emma.",,
9,9782413043591,Le mirage de la croissance verte,,Anthony Auffret,2022,152.0,NOT_MATURE,fr,,,,
10,9782348072765,Vieille fille,une proposition,Marie Kock,2022,0.0,NOT_MATURE,fr,,,,
11,9782206013725,Rendre les élèves acteurs de leurs apprentissages,,"Yves Béal, Frédérique Maïaux",2008,142.0,NOT_MATURE,fr,,"Présentation de réflexions et de remarques autour de cette question pédagogique, avec des pistes et des outils. [source inconnue].",Apprentissage par l'action,
12,9782765033202,L'apprentissage par projets au secondaire,guide pratique pour planifier et réaliser des projets avec ses élèves,"John Larmer, Louise Capra, David Ross, Lucie Arpin, John R. Mergendoller, Buck Institute for Education",2011-08,119.0,NOT_MATURE,fr,,,"Education, Secondary",
13,9782011709219,Pour une pédagogie du projet,,"Isabelle Bordalo, Jean-Paul Ginestet",2006,190.0,NOT_MATURE,fr,,"La demande de projet est incontournable, dans le domaine scolaire tout autant que dans l'ordre du social, parce qu'elle permet aux individus de s'impliquer activement dans les tâches qu'ils ont à effectuer. C'est pourquoi Isabelle Bordalo et Jean-Paul Ginestet sont allés puiser dans l'enseignement technologique où cette méthode a été mise en oeuvre systématiquement. Ils démontrent que cette forme particulière de pédagogie a contribué à faire entrer à l'école un peu du monde de l'entreprise et que le transfert des méthodes et des outils utilisés en technologie est possible dans les autres champs disciplinaires.",Enseignement,http://books.google.com/books/content?id=8hazAAAACAAJ&printsec=frontcover&img=1&zoom=1&source=gbs_api
14,9782850084324,Une classe qui coopère,pourquoi ? comment ?,Christian Staquet,2007,203.0,NOT_MATURE,fr,,"Comment organiser les apprentissages pour que les élèves apprennent et s'apprennent les uns des autres en coopérant dans le travail ? La pédagogie coopérative implique les partenaires autour d'un objectif de travail ou d'apprentissage pour des échanges et des intelligences collectives. Elle donne aux élèves des outils de progression, de responsabilisation et de compréhension de leurs apprentissages en équipe. Apprendre à travailler avec les autres, c'est apprendre sur soi et grandir avec les autres. Il y a, dans cette approche active, interactive et basée sur le respect de chaque personne, une vraie manière de (re) motiver le travail scolaire en le reliant à la vie sociale du groupe, aux richesses de chacun, aux interactions entre pairs et, indirectement, aux interactions extra scolaires de l'élève. Apprendre à travailler avec les autres, dans des tâches qui ne sont pas spécialement nos points forts, mais avec le soutien des coéquipiers, est une étape très importante vers l'approche polyvalente de la vie et de la réussite des objectifs. Une décolonisation des habitudes de dépendances réciproques avec les élèves est nécessaire. Il est du ressort de l'adulte de ne plus proposer ou induire un modèle unique pour des stratégies de travail ou des pratiques d'apprentissages. Le défi de l'école est d'apprendre à apprendre, d'apprendre à se construire et d'apprendre à vivre ensemble. La coopération participe à des relations pacifiques, responsables et enrichissantes, des plus évoluées et des plus démocratiques.",Apprentissage - Travail en équipe,
15,2850085510,Penser le projet,concepts et outils d'une pédagogie émancipatrice,Francis Tilman,2004,203.0,NOT_MATURE,fr,,"La pédagogie du projet est omniprésente dans la littérature pédagogique. Elle est recommandée par les décideurs tant pour les pratiques scolaires que pour la formation d'adultes. Elle est parée d'immenses vertus éducatives. Mais est-elle vraiment cette pédagogie si novatrice et si performante ? Si nous concevons l'éducation comme une œuvre d'émancipation, à quelles conditions et dans quelles circonstances la pédagogie du projet peut-elle être un instrument au service de cet idéal ? À partir de l'expérience de l'équipe du Grain, voici un véritable guide de la pédagogie du projet émancipateur. Après un détour nécessaire pour clarifier la multiplicité de sens du mot projet, l'auteur nous présente trois formes de projet : le projet personnel, le projet de groupe et le projet d'organisation. Pour chacune, il précise ses caractéristiques et les conditions d'une pratique progressiste de la démarche. Les clarifications théoriques sont émaillées de nombreux exemples et accompagnées de la présentation d'outils pour une pratique efficace de chaque type de projet. Enfin, l'ouvrage interroge le succès que connaît aujourd'hui l'idéologie du projet et les risques d'illusion qu'elle véhicule. Un guide clair, accessible, approfondi et pragmatique.",Enseignement - Méthode des projets,
16,9782816195590,Pays-Bas,,"Nicola Williams, Abigail Hole, Mark Elliott",2022,382.0,NOT_MATURE,fr,,"Lonely Planet : un guide de référence, à la fois pratique et culturel, pour découvrir les Pays-Bas. Un guide tout en couleurs pour apprécier la beauté d'un pays hors norme. Un aperçu des sites incontournables et des meilleures expériences sur place : les canaux d'Amsterdam, les chefs-d'œuvre néerlandais, le parc national de la Haute-Veluwe, Delft, Maastricht, Rotterdam, Texel, les fromages... Des suggestions d'itinéraires et une sélection thématique pour organiser un voyage en phase avec ses envies : architecture, marchés, cyclotourisme, moulins à vent... Un chapitre consacré aux voyages en famille. Un chapitre spécifique pour découvrir les Pays-Bas à vélo (renseignements, principales routes, des itinéraires décrits dans le détail, organisation, équipement, sécurité, hébergement...). De nombreuses cartes ainsi qu'une couverture approfondie des moyens de transport pour être autonome dans ses déplacements. Des focus sur l'histoire et la société néerlandaise, arts et architecture, environnement, cuisine locale...",,
17,9782016256336,Amsterdam,,Katherine Vanderhaeghe,2018-11-21,208.0,NOT_MATURE,fr,,,,
18,9782017884026,Amsterdam,"Rotterdam, Delft et La Haye",Le Routard,2023-08-30,0.0,NOT_MATURE,fr,,,,
19,9782067257863,Pays-Bas,,Manufacture française des pneumatiques Michelin,2023,0.0,NOT_MATURE,fr,,,,
20,9782822902526,Amsterdam,,"Christopher Catling, Gabriella Le Breton",2020-03-05,271.0,NOT_MATURE,fr,,,,
21,9782715413801,Histoire des États-Unis,,François Durpaire,2023,0.0,NOT_MATURE,fr,,"Faire l'histoire des États-Unis, le projet permet de lever un premier préjugé, celui d'un pays si "" jeune "" qu'il n'aurait pas d'histoire. Du jour de l'indépendance à la guerre de Sécession, de la conquête de l'Ouest à celle de la Lune, de la crise de 1929 aux attentats du 11 septembre 2001, cet ouvrage raconte le roman vrai de l'Amérique. Au-delà d'un simple récit chronologique, François Durpaire montre combien les États-Unis résistent à toute compréhension simpliste. Il nous invite à lire l'histoire de ce pays comme celle d'un dialogue ininterrompu entre l'unité et la diversité, qui sont les deux valeurs inscrites dans la devise originelle des États-Unis d'Amérique : e pluribus unum - "" de plusieurs, un "".",,
22,9782035993250,"C'est psy ? Non, hormonal !",,Marion Gluck,2020-08-19,288.0,NOT_MATURE,fr,,,,
23,9782378801267,C'est mon corps,Toutes les questions que se posent les femmes sur leur santé,Martin Winckler,2020-09-09,504.0,NOT_MATURE,fr,,,,
24,2130486851,Le sentiment de justice dans les relations sociales,,"Jean Kellerhals, Marianne Modak, David Perrenoud",1997,127.0,NOT_MATURE,fr,,"Etude sur les formes que prend le sentiment de justice dans les relations sociales. Se veut une introduction à une approche empirique du sentiment de justice distributive dans les groupes. On vise à cerner d'abord la diversité des normes de justice, à comprendre la relation entre la position sociale des personnes et leurs critères de justice, à montrer à quel point les normes de justice sont solidaires de la cohésion du groupe et, enfin, à définir les procédures jugées légitimes par les membres du groupe. Fait écho à un livre publié en 1988 ##Figures de l'équité## (PUF). [SDM].",Distributive justice,
25,9782340035461,S'capade pédagogique avec les jeux d'évasion,Apprendre grâce aux escape games,"Mélanie Fenaert, Patrice Nadam, Anne Petit",2019-12-10,238.0,NOT_MATURE,fr,,,,
26,9782067253407,"Michelin Le Guide Vert Pays Basque, Navarre",,,2022-02-02,498.0,NOT_MATURE,fr,,,,
27,9782205073850,Le rapport de Brodeck,,,2015,158.0,NOT_MATURE,fr,,,,
28,2367310254,Hanbok,,Sophie Darcq,2023,0.0,NOT_MATURE,fr,,"Sophie Darcq est à la fois une inconnue, puisque Hanbok est son premier livre, et quelqu'un qu'on ne présente plus dans le milieu de l'édition alternative ou dans la petite communauté d'autrices et d'auteurs d'Angoulême, où son talent est reconnu depuis longtemps. Née Coréenne en 1976, française d'adoption, Sophie Darcq est diplômée de l'EESI et a été résidente à la Maison des Auteurs d'Angoulême, avant de décider de partir en Corée sur les traces de sa famille biologique, avec l'une de ses quatre sœurs. C'est cette histoire que raconte Hanbok, récit familial poignant, entre l'exorcisme et la nécessité de connaître ses racines. Commencé il y a une quinzaine d'années, ce premier tome de Hanbok (sur deux prévus) se démarque du flux de bandes dessinées autobiographiques actuel par le profond besoin de vérité qu'on y trouve et par le brio du dessin. Passant avec désinvolture d'un style réaliste époustouflant à une grammaire minimaliste, d'un registre épistolaire à une narration historique, Sophie Darcq maîtrise son sujet et le langage de la bande dessinée comme peu d'autrices publiant leur premier livre.",Adopted children,http://books.google.com/books/content?id=IM6kzwEACAAJ&printsec=frontcover&img=1&zoom=1&source=gbs_api
29,9782340027787,Philosophia,Une histoire de la philosophie en BD,Nicolas Tenaillon,2018-10-30,256.0,NOT_MATURE,fr,,"Philosophia, c'est une histoire de la philosophie en bande dessinée. Des premiers philosophes grecs jusqu'à ceux d'aujourd'hui, ce roman graphique de la pensée se veut une introduction ludique et esthétique aux grandes idées qui ont rendu célèbres des auteurs aussi incontournables que Platon, Descartes, Kant et bien d'autres...",,
30,9782383381372,Chaussettes,20 modèles à tricoter toute l'année,Niina Laitinen,2023,0.0,NOT_MATURE,fr,,,,
31,9782212675504,Tricoter ses chaussettes,Les techniques pour débuter,Wendy Johnson,2018-09-27,143.0,NOT_MATURE,fr,,"Cet ouvrage propose plusieurs méthodes pour tricoter ses chaussettes en commençant par la pointe du pied - technique qui présente l'avantage de pouvoir essayer les chaussettes au fur et à mesure que l'on progresse et de les adapter parfaitement à sa taille. L'auteur montre également plusieurs façons de tricoter le talon et d'arrêter les mailles. A chacun de choisir ensuite ce qui lui convient. 23 modèles de chaussettes de difficulté croissante permettent de mettre en pratique ces techniques en les combinant avec des points de tricot plus ou moins complexes : points dentelle, texturés, torsades... Une mine d'information et d'inspiration, illustré de photographies lumineuses et colorées.",,
32,9782713228209,Le métier de sociologue,Préalables épistémologiques,"Pierre Bourdieu, Jean-Claude Chamboredon, Jean-Claude Passeron",2021-02-04,576.0,NOT_MATURE,fr,,,,
33,9782203045682,Le dahlia noir,,"Matz, David Fincher, James Ellroy",2013-11-13,170.0,NOT_MATURE,fr,,"Los Angeles Police Department, 1946. Dwight ""Bucky"" Bleichert fête son premier jour aux Mandats, le prestigieux service où rêvent de travailler la plupart des flics de la Cité des Anges. Il fera équipe avec Leland ""Lee"" Blanchard, un collègue qui comme lui a été boxeur, et qu’il a déjà affronté sur un ring. Malgré les nondits entre eux, les deux hommes sympathisent. Ils ne savent pas encore qu’ils vont enquêter ensemble sur un crime qui va à la fois les rapprocher et bouleverser leurs existences : la mort atroce d’une jeune femme, Elizabeth ""Betty"" Short, surnommée le Dahlia Noir, dont on retrouve le corps mutilé dans un terrain vague, en janvier 1947... Ainsi débute l’un des plus fameux romans noirs de la littérature américaine des dernières décennies, à la fois polar haletant et portrait saisissant de Los Angeles, dans toute sa fascination trouble : Le Dahlia noir, de James Elroy. C’est le plus francophile des dessinateurs américains, Miles Hyman, déjà auteur avec Matz, dans la même collection, d’une adaptation de Nuit de fureur de Jim Thompson, qui en signe la mise en images, très inspiré par la ville de Los Angeles où il a personnellement vécu plusieurs années. L’adaptation du roman d’Ellroy en bande dessinée est assurée une fois encore par Matz, mais cette fois-ci à quatre mains puisqu’il a travaillé en équipe avec le cinéaste David Fincher.",,
34,9782723467834,Le bleu est une couleur chaude,,Julie Maroh,2010,156.0,NOT_MATURE,fr,,"La vie de Clémentine bascule le jour où elle rencontre Emma, une jeune fille aux cheveux bleus qui lui fait découvrir toutes les facettes du désir et lui permet d'affronter enfin le regard des autres. Adapté au cinéma par Abdellatif Kechiche sour le titre La vie d'Adèle, Palme d'or au Festival de Cannes 2013.",Dating (Social customs),
35,9782247060009,Dictionnaire de la pensée politique,"idées, doctrines et philosophes","Olivier Nay, Johann Michel, Antoine Roger",2005,228.0,NOT_MATURE,fr,,"Le Dictionnaire de la pensée politique présente, sous une forme simple et accessible, les principaux courants d'idées, les grands débats philosophiques et les auteurs majeurs de la pensée politique occidentale. Il couvre toutes les périodes de l'histoire depuis l'Antiquité et aborde une très grande diversité de thèmes : la philosophie des Anciens, les doctrines du Moyen Age, l'humanisme de la Renaissance, les grands projets des lumières, mais aussi les réflexions sur le pouvoir, la justice, l'État, la nation, la démocratie, le socialisme, le libéralisme, le totalitarisme ou le communautarisme. Guidé par un souci de rigueur, de concision et de clarté, il présente les idées politiques dans leur rapport avec les évolutions sociales, politiques et culturelles de l'Europe et du monde. Certaines notices sont consacrées à un auteur et à son œuvre. D'autres traitent un concept ou une idée philosophique centrale ayant nourri la réflexion sur le pouvoir et la société. D'autres enfin, privilégiant un angle historique, analysent l'évolution d'une sensibilité doctrinale ou intellectuelle. Le dictionnaire s'adresse aux étudiants des cursus de philosophie, de droit, d'histoire et de science politique. Il sera particulièrement utile aux étudiants de Sciences-Po et aux élèves des classes préparatoires. Il offre à chacun les moyens d'approfondir ses connaissances sur les grands débats qui ont influencé le cours de l'histoire.",Political science,
36,9782800164199,Roger et ses humains,,,2015-11-20,86.0,NOT_MATURE,fr,,"- Une histoire complète divisée en strips de trois cases qui peuvent se lire indépendamment - La première incursion dans la BD de Cyprien Iov, premier youtuber français et phénomène web (6,7 millions d'abonnés sur sa chaine YouTube) - L'un des premiers ouvrages de « Disquette », la nouvelle collection de la nouvelle génération !",,
37,9782505120094,"Simenon, l'Ostrogoth Tome 1",,"José-Louis Bocquet, Jean-Luc Fromental",2023-02-10,0.0,NOT_MATURE,fr,,,,
38,9782100830824,Géostratégix,la géopolitique mondiale de 1945 à nos jours en BD,Pascal Boniface,2022,0.0,NOT_MATURE,fr,,"À l'heure de la globalisation, peut-on comprendre le monde contemporain sans connaître la chaîne des événements qui l'ont façonné, la logique des rivalités, les affrontements des puissances ? L'essor du monde bipolaire puis sa disparition, la décolonisation, l'enjeu de l'arme nucléaire, la globalisation de l'économie, l'émergence de nouvelles puissances... aucun de ces aspects n'est isolé, ils interviennent au cours d'une grande histoire interconnectée et jouée par des acteurs hors normes, de Roosevelt à Trump en passant par de Gaulle, Mao, Castro, Mandela et Poutine. Le géopolitologue Pascal Boniface, connu pour sa clarté pédagogique, décrypte les principaux rouages des grands événements historiques depuis 1945 et leurs conséquences actuelles. Un récit passionnant, judicieusement mis en images par le dessinateur Tommy, qui adjoint à une vaste galerie de portraits des cartes explicatives et un trait d'humour bienvenu. On apprend et on comprend en souriant.",,
39,9782203221918,Partir,sur les chemins de Compostelle,Lili Sohn,2022,0.0,NOT_MATURE,fr,,"2 mois pour rejoindre Saint-Jacques de Compostelle depuis Cajarc et le Mas de Jantille.02 mois et 1250 km, seule et le strict nécessaire dans un sac à dos.02 mois pour se réapproprier l'espace et le mouvement entre deux confinements.02 mois de marche, de réflexion et d'initiation.02 mois pour questionner son rapport au corps, aux autres, à la nature.",,
