i,isbn,title,subtitle,authors,publishedDate,pageCount,maturityRating,language,textSnippet,description,categories,thumbnail
676,9782757605318,La faim émotionelle,,Bénédicte Le Panse,2022,0.0,NOT_MATURE,fr,,"""Exercer la physio-psychologie au sein des émotions nutritionnelles est une entreprise des plus gratifiantes. Les patients sont heureux lorsqu'on trouve une réponse qui fonctionne. La démarche est aussi passionnante sur un plan intellectuel qu'elle est épanouissante sur le plan émotionnel. Chaque personne que j'ai rencontrée, et que je rencontre encore est une véritable énigme. Pourquoi la prise de poids apparaît-elle à ce moment et pas à un autre ? Pourquoi cette prise de poids existe-t-elle ? Pourquoi sont-elles si nombreuses ? si communes parfois. La sélection naturelle aurait pu éliminer le stress, l'anxiété, l'addiction, la névrose, ou bien tout autre pulsion alimentaire excessive ou pas. Mais elle ne l'a pas fait. Et c'est l'objectif de ce livre : pourquoi sommes-nous vulnérables et comment essayer de pallier toutes ces émotions qui nous envahissent ? Les réponses envisagées dans cet ouvrage ne sont que des exemples issus de mon expérience de terrain et rien d'autre. Des expériences qui auront permis à chacun de sortir la tête de l'eau"".",,
677,9791022610438,Sourire,Anthropologie de l'énigmatique,David Le Breton,2022,221.0,NOT_MATURE,fr,,"Le sourire se devine, il gagne les yeux, transforme subtilement le visage, au bas mot nous humanise. Les savants constatent que le sourire est la réaction la plus faible du visage et les poètes comme Paul Valéry qu'il est ""le premier luxe de l'être"". Da,ns notre relation discrète à l'autre, le sourire est perçu comme un effleurement de l'âme. Tout le monde reconnaît que c'est un adoucisseur de contact quand il n'est pas convenu, narquois, exaspérant ou bêtement posé sur les lèvres pour donner le change. C'est une expression retenue mais lisible qui permet aux individus de communiquer différemment, à la fois sans mot et de tout leur corps. Il peut être aussi l'expression d'une ritualité et participer sciemment à l'expression de son appartenance sociale. cette anthropologie de l'énigmatique que David Le Breton développe avec finesse dans cet ouvrage touche autant au corps, à nos conventions sociales, qu'à notre spiritualité, vraie ou naîve, qui nous fait exister et résister à la brutalité du monde. le sourire œuvre en secret et nous permet de communiquer presque secrètement notre soi à l'autre.",,
678,9782415002770,Apologie de la discrétion,comment faire partie du monde ?,Lionel Naccach,2022,0.0,NOT_MATURE,fr,,,,
679,9782324032066,Une histoire photographique des femmes au XXe siècle /,,,,,,,,,,
680,9782738134325,La société du paraître,"Les beaux, les jeunes... et les autres",Jean-François Amadieu,2016-09-07,256.0,NOT_MATURE,fr,,"Le fond de la salle, est-ce ce qui nous attend encore aujourd'hui dans un restaurant chic si nous ne sommes pas jugé assez beau ? Un décolleté plongeant, des hauts talons et une taille 36 : est-ce toujours un atout pour réussir un entretien d'embauche ? Le chômage : est-ce vraiment ce qui nous guette si nous perdons notre emploi après 50 ans ? Plus d'argent : est-ce, à compétences égales, nécessairement ce que gagnera un homme sportif par rapport à un quadragénaire en surpoids ? Après l'immense succès de son livre Le Poids des apparences, Jean-François Amadieu explore un nouveau volet de cet impérialisme du paraître dans nos sociétés, en s'appuyant sur des enquêtes inédites concernant notamment les réseaux sociaux, le monde du travail, la politique ou la télévision. Il était inévitable que le culte de la beauté, de la minceur ou de la jeunesse finisse par provoquer des refus et des réactions dans l'opinion publique. Allons-nous enfin être libérés de la tyrannie des apparences ?",,
681,2738111378,Poids des apparences (Le),"Beauté, amour et gloire",Jean-François Amadieu,2002-03,228.0,NOT_MATURE,fr,,"Réussit-on mieux à l'école si on est beau ? A-t-on plus de chances de trouver un premier emploi, de faire une belle carrière ou de bien gagner sa vie ? Est-on plus heureux en amour ou en ménage ? Voici, entre démonstration et dénonciation, une étude précise des effets de l'apparence physique sur la réussite scolaire, professionnelle, amoureuse ou encore politique. Et si notre visage, notre corps, nos vêtements et notre allure jouaient un rôle essentiel dans notre destinée ? Et si l'apparence physique était un des facteurs les plus insidieux de discrimination sociale et de reproduction des inégalités ? Jean-François Amadieu est professeur à l'université de Paris-I-Panthéon - Sorbonne où il enseigne la sociologie et la gestion des ressources humaines.",Social Science,http://books.google.com/books/content?id=-kt4tc8t15QC&printsec=frontcover&img=1&zoom=1&edge=curl&source=gbs_api
682,2738116981,Défauts physiques imaginaires (Les),Comprendre et soigner le BDD,Jean Tignol,2006-01-25,208.0,NOT_MATURE,fr,,"﻿On peut souffrir d’un défaut physique réel, en être gêné, mais vivre avec. On peut aussi recourir à la chirurgie esthétique et s’en débarrasser. Mais quand on est obsédé par un défaut qui n’existe pas, un défaut que personne d’autre ne voit et qui empêche de vivre, quelles sont les solutions ? Ce type de préoccupation pathologique pour un défaut imaginaire conduit tous les ans des milliers de femmes, mais aussi d’hommes, à consulter et à multiplier des traitements médicaux ou chirurgicaux parfaitement inefficaces puisque sans objet… Pourquoi ces errements ? Comment sortir de cette obsession ? Psychiatre, psychothérapeute, le docteur Jean Tignol est professeur à l’université Victor Segalen et chef de service au CHU à Bordeaux.",Psychology,http://books.google.com/books/content?id=DSUqAcHYTYoC&printsec=frontcover&img=1&zoom=1&edge=curl&source=gbs_api
683,9782707302755,La distinction : critique sociale du jugement /,,,,,,,,,,
684,9782081245648,Les mondes de l'art /,,,,,,,,,,
685,2234092477,Quand tu écouteras cette chanson,,Lola Lafon,2022,0.0,NOT_MATURE,fr,,"Le 18 août 2021, j'ai passé la nuit au Musée Anne Frank, dans l'Annexe. Anne Frank, que tout le monde connaît tellement qu'il n'en sait pas grand-chose. Comment l'appeler, son célèbre journal, que tous les écoliers ont lu et dont aucun adulte ne se souvient vraiment. Est-ce un témoignage, un testament, une oeuvre ? Celle d'une jeune fille, qui n'aura pour tout voyage qu'un escalier à monter et à descendre, moins d'une quarantaine de mètres carrés à arpenter, sept cent soixante jours durant. La nuit, je l'imaginais semblable à un recueillement, à un silence. J'imaginais la nuit propice à accueillir l'absence d'Anne Frank. Mais je me suis trompée. La nuit s'est habitée, éclairée de reflets ; au coeur de l'Annexe, une urgence se tenait tapie encore, à retrouver.","Authors, French",http://books.google.com/books/content?id=OatczwEACAAJ&printsec=frontcover&img=1&zoom=1&source=gbs_api
686,9782889070251,L'épouse,,Anne-Sophie Subilia,2022,0.0,NOT_MATURE,fr,,"Janvier 1974, Gaza. L'Anglaise Piper emménage avec son mari, délégué humanitaire. Leurs semaines sont rythmées par les vendredis soir au Beach Club, les bains de mer, les rencontres fortuites avec la petite Naïma. Piper doit se familiariser avec les regards posés sur elle, les présences militaires, avec la moiteur et le sable qui s'insinue partout, avec l'oisiveté. Le mari s'absente souvent. Guettée par la mélancolie, elle s'efforce de trouver sa place. Le baromètre du couple oscille. Heureusement, il y a Hadj, le vieux jardinier, qui sait miraculeusement faire pousser les fleurs à partir d'une terre asséchée. Et Mona, psychiatre palestinienne sans mari ni enfants, pour laquelle Piper a un coup de cœur. Mais cela suffit-il ? Plus que jamais, dans ""L'Épouse"", Anne-Sophie Subilia révèle la profondeur de l'ordinaire. La lucidité qui la caractérise ne donne aucune circonstance atténuante à ses personnages.",,http://books.google.com/books/content?id=KixuzwEACAAJ&printsec=frontcover&img=1&zoom=1&source=gbs_api
687,9782080207340,Vivre vite,,Brigitte Giraud,2022,0.0,NOT_MATURE,fr,,"""J'ai été aimantée par cette double mission impossible. Acheter la maison et retrouver les armes cachées. C'était inespéré et je n'ai pas flairé l'engrenage qui allait faire basculer notre existence. Parce que la maison est au coeur de ce qui a provoqué l'accident"". En un récit tendu qui agit comme un véritable compte à rebours, Brigitte Giraud tente de comprendre ce qui a conduit à l'accident de moto qui a coûté la vie à son mari le 22 juin 1999. Vingt ans après, elle fait pour ainsi dire le tour du propriétaire et sonde une dernière fois les questions restées sans réponse. Hasard, destin, coïncidences ? Elle revient sur ces journées qui s'étaient emballées en une suite de dérèglements imprévisibles jusqu'à produire l'inéluctable. A ce point électrisé par la perspective du déménagement, à ce point pressé de commencer les travaux de rénovation, le couple en avait oublié que vivre était dangereux. Brigitte Giraud mène l'enquête et met en scène la vie de Claude, et la leur, miraculeusement ranimées.""--Page 4 de la couverture",,http://books.google.com/books/content?id=ZelhzwEACAAJ&printsec=frontcover&img=1&zoom=1&source=gbs_api
688,235687674X,Éduquer en anthropocène /,,,,,,,,,,
689,9782702921241,Psychologie du sentiment d'injustice : comprendre et traiter la souffrance /,,,,,,,,,,
690,9782067255890,Crète,,,2022,0.0,NOT_MATURE,fr,,,,
691,9782070140855,Oeuvres /,,,,,,,,,,
692,9782321012443,Le Petit Robert,dictionnaire alphabétique et analogique de la langue française,Robert (Firme),2018,0.0,NOT_MATURE,fr,,"Une description inégalée de la langue française : La langue d'aujourd'hui : Les mots nouveaux et les emplois Les plus récents, l'orthographe et ses dernières évolutions ; L'usage de chaque mot : son orthographe, sa prononciation, ses différentes significations illustrées de nombreux exemples, Les expressions et les locutions où il figure ; L'étymologie : l'histoire du mot, avec sa date d'apparition, son origine et Le cheminement de ses sens. Au fil des mots et des textes : Laissez-vous porter par Les mots et passez des synonymes aux contraires, d'une idée à L'autre, du connu à L'inconnu ; Plongez dans les citations des grandes oeuvres de la littérature, des auteurs classiques ou contemporains ; retrouvez avec plaisir des phrases célèbres, des répliques de films et des paroles de chansons ; Voyagez dans La francophonie, de L'Europe aux îles du Pacifique en passant par L'Amérique du Nord et les Antilles, et partez à la rencontre de ses richesses.",Reference,http://books.google.com/books/content?id=Jyp7tgEACAAJ&printsec=frontcover&img=1&zoom=1&source=gbs_api
693,9782321017639,Le Petit Robert de la Langue Française 202,,"Alain Rey, Josette Rey-Debove",2022,2836.0,NOT_MATURE,fr,,,Reference,http://books.google.com/books/content?id=I173zgEACAAJ&printsec=frontcover&img=1&zoom=1&source=gbs_api
694,222647871X,Pourquoi la guerre ? /,,,,,,,,,,
695,9782382844977,"À la folie, passionnément /",,,,,,,,,,
696,9782340077997,Pascal,,Thomas Petit,2023-04-25,0.0,NOT_MATURE,fr,,,,
697,9782370734730,La danse : philosophie du corps en mouvement /,,,,,,,,,,
698,9782228909648,Puissance de la douceur,,Anne Dufourmantelle,2013-08-21,143.0,NOT_MATURE,fr,,"La douceur est une énigme. Incluse dans un double mouvement d'accueil et de don, elle apparaît à la lisière des passages que naissance et mort signent. Parce qu'elle a ses degrés d'intensité, parce qu'elle a une force symbolique et un pouvoir de transformation sur les êtres et les choses, elle est une puissance. En écoutant ceux qui viennent me confier leur détresse, je l'ai entendue traverser chaque expérience vécue. En méditant son rapport au monde, il apparaît que son intelligence porte la vie, la sauve et l'accroît.",Calmness,
699,9782738135155,L'Intelligence Animale,,Emmanuelle Pouydebat,2017-02-22,,NOT_MATURE,fr,,,,
700,9782824913971,La Condition ouvrière,,Simone Weil,2023-09,0.0,NOT_MATURE,fr,,,,
701,9782259277952,La pesanteur et la grâce /,,,,,,,,,,
702,9782415006907,Mes plus belles rencontres animales,,Emmanuelle Pouydebat,2023-10-04,0.0,NOT_MATURE,fr,,,,
703,9782707142375,Trouble dans le genre,Pour un feminisme de la subversion,Judith Butler,2005,0.0,NOT_MATURE,fr,,"Dans cet ouvrage majeur publié en 1990 aux Etats-Unis, la philosophe Judith Butler invite à penser le trouble qui perturbe le genre pour définir une politique féministe sans le fondement d'une identité stable. Ce livre désormais classique pour les recherches sur le genre, aussi bien que les études gaies et lesbiennes, est au principe de la théorie et de la politique queer : non pas solidifier la communauté d'une contre-culture, mais bousculer l'hétérosexualité obligatoire en la dénaturalisant. Il ne s'agit pas d'inversion, mais de subversion. Judith Butler localise les failles qui manifestent à la marge le dérèglement plus général de ce régime de pouvoir. En même temps, elle soumet à la question les injonctions normatives qui constituent les sujets sexuels. Jamais nous ne parvenons à nous conformer tout à fait aux normes : entre genre et sexualité, il y a toujours du jeu. Le pouvoir ne se contente pas de réprimer ; il ouvre en retour, dans ce jeu performatif, la possibilité d'inventer de nouvelles formations du sujet. La philosophe relit Michel Foucault, Sigmund Freud, Jacques Lacan et Claude Lévi-Strauss, mais aussi Simone de Beauvoir, Luce Irigaray, Julia Kristeva et Monique Wittig, afin de penser, avec et contre eux, sexe, genre et sexualité - nos désirs et nos plaisirs. Pour jeter le trouble dans la pensée, Judith Butler donne à voir le trouble qui est déjà dans nos vies. (Decitre.fr).",Femininity,
704,9782130837893,Infocratie,Numérique et crise de la démocratie,Byung-Chul Han,2023-09-06,0.0,NOT_MATURE,fr,,,,
705,9782707193162,Résonance,Une sociologie de la relation au monde,Hartmut Rosa,2018-09-13,535.0,NOT_MATURE,fr,,,,
706,9782707329837,Continuer : [roman] /,,,,,,,,,,
707,2081479389,Une voix différente : la morale a-t-elle un sexe ? /,,,,,,,,,,
708,9782738152251,L'attachement en questions,,Blaise Pierrehumbert,2020-06-17,260.0,NOT_MATURE,fr,,,,
709,9782804185206,Esthétique et philosophie de l'art,Repères historiques et thématiques,L'Atelier d'esthétique,2014-04-14,529.0,NOT_MATURE,fr,,"Cet ouvrage présente un panorama historique et thématique de la pensée esthétique occidentale. La réflexion philosophique s'y intègre dans le concert des multiples approches dont l'art et l'expérience du beau, du sublime ou encore de la mimèsis peuvent faire l'objet. Un dialogue approfondi avec la littérature artistique, la critique et les sciences de l'art apparaît, en effet, comme un axe nécessaire de l'approche philosophique elle-même, dont la dynamique propre oriente néanmoins l'ensemble ici proposé. Le volume se structure en deux parties. La première, la plus importante par le nombre de pages, retrace la genèse historique des grands concepts esthétiques de la tradition occidentale, de Platon à Derrida, de la pensée analytique anglo-saxonne à la phénoménologie en passant par la théologie de l'image et l'idéalisme allemand. Dans la seconde partie, les concepts ainsi dégagés entrent en action face à quelques interrogations majeures que rencontrent, aujourd'hui, la philosophie de l'art et l'esthétique. On y relance les outils que nous a livrés la tradition, sans se refuser à emprunter telle ou telle voie rapide qui, par exemple, remonte de l'art contemporain à la Grèce antique ou propulse des Encyclopédistes au post-modernisme. L'attention concrète aux oeuvres d'art elles-mêmes tient la place qui lui revient dans le cadre de ces questionnements de premier degré.",Philosophy,http://books.google.com/books/content?id=y1kEDgAAQBAJ&printsec=frontcover&img=1&zoom=1&edge=curl&source=gbs_api
710,2252034912,Théorie esthétique /,,,,,,,,,,
711,9782842423568,La société de la fatigue,,Byung-Chul Han,2014-03-06,113.0,NOT_MATURE,fr,,"Nous assistons aujourd'hui, sans nous en rendre compte, à un changement de paradigme. La société de la négativité est en train de céder sa place à une société dominée par une surcharge de positivité. Partant de ce changement, Han décrit le paysage pathologique de notre société actuelle dominée par des affections neuronales comme la dépression, le syndrome de déficit d'attention, le trouble de la personnalité borderline ou le burn-out. Ce ne sont pas des infections, ce sont des infarctus, non pas conditionnés par la négativité d'un autre immunologique, mais par une surcharge en positivité. Ils se dérobent donc à toutes les techniques immunologiques de prophylaxie et de défense immunitaire. L'analyse de Han aboutit finalement à la vision d'une société qu'il appelle, dans une ambivalence intentionnelle, une ""société de la fatigue"".","Depression, Mental",
712,9782707320759,Des hommes : [roman] /,,,,,,,,,,
713,9782019109950,Percy Jackson - Tome 1,Le Voleur de Foudre,Rick Riordan,2016-10-12,0.0,NOT_MATURE,fr,,"Je n'ai jamais voulu être un demi-dieu. Une vie de demi-dieu, c'est dangereux, c'est angoissant. Le plus souvent, ça se termine par une mort abominable et douloureuse. Il se peut que vous soyez des nôtres. Or, dès l'instant où vous le saurez, il ne leur faudra pas longtemps pour le percevoir, eux aussi, et se lancer à vos trousses. Je vous aurai prévenus.","Animals, Mythical",http://books.google.com/books/content?id=UaQUvgAACAAJ&printsec=frontcover&img=1&zoom=1&source=gbs_api
714,9782266278638,Circé /,,,,,,,,,,
715,9782226448453,Sapiens /,,,,,,,,,,
716,9782070327607,Qu'est-ce que la philosophie antique ? /,,,,,,,,,,
717,2827106329,La philosophie comme thérapie de l'âme,études de philosophie hellénistique,André-Jean Voelke,1993,139.0,NOT_MATURE,fr,,,"Philosophy, Ancient",
718,0582216206,English historical syntax : verbal constructions /,,,,,,,,,,
719,9027222843,Corpus approaches to grammaticalization in English /,,,,,,,,,,
720,0521785707,The English Language,A Historical Introduction,Charles Laurence Barber,2000-05-04,324.0,NOT_MATURE,en,,"The English Language: A Historical Introduction covers the history of the English language from its prehistoric Indo-European origins to the present day. Assuming no previous knowledge of the subject, Charles Barber describes the nature of language and language change, and presents a history of the English language at different periods, dealing with key topics such as grammar, pronunciation and semantics. Where necessary, he introduces and explains the main theoretical and technical concepts of historical linguistics. There are also chapters on English in the scientific age, English as a world language and the future of the language. Charles Barber uses dozens of familiar texts, including the English of King Alfred, Chaucer, Shakespeare, and Addison, to illustrate the state of the English language through time in a range of contexts. This is a fascinating book for anyone with an interest in language.",Language Arts & Disciplines,http://books.google.com/books/content?id=KKgHkD6O1-cC&printsec=frontcover&img=1&zoom=1&edge=curl&source=gbs_api
721,9789027205087,Late modern English : novel encounters /,,,,,,,,,,
722,9782412070253,Le jour où j'ai réalisé que la personne toxique c'était moi,,Christine Berrou,2021-09-23,185.0,NOT_MATURE,fr,,,,
723,2730400893,L'Hiver de notre mécontentement,roman,John Steinbeck,1981,290.0,NOT_MATURE,fr,,,,
724,2920932187,Les 5 blessures qui empêchent d'être soi-même,"rejet, abandon, humiliation, trahison, injustice",Lise Bourbeau,2000,233.0,NOT_MATURE,fr,,Dans la mouvance de ses autres livres ±Écoute ton corps et ±Qui es-tu?. [SDM].,"Body, Mind & Spirit",http://books.google.com/books/content?id=9ewAaH56lVcC&printsec=frontcover&img=1&zoom=1&edge=curl&source=gbs_api
725,1984817795,Daisy Jones & The Six,A Novel,Taylor Jenkins Reid,2019-03-05,368.0,NOT_MATURE,en,,,Fiction,
726,9782321017639,Le Petit Robert de la Langue Française 202,,"Alain Rey, Josette Rey-Debove",2022,2836.0,NOT_MATURE,fr,,,Reference,http://books.google.com/books/content?id=I173zgEACAAJ&printsec=frontcover&img=1&zoom=1&source=gbs_api
727,2020561700,L'empire cybernétique,des machines à penser à la pensée machine : essai,Céline Lafontaine,2004,235.0,NOT_MATURE,fr,,"Du structuralisme à la philosophie postmoderne de la déconstruction au systémisme, de Claude Lévi-Strauss à Jacques Lacan, de Gilles Deleuze à Jean-François Lyotard, une bonne part de la pensée européenne des cinquante dernières années a été souterrainement influencée par un ensemble de présupposés théoriques élaborés dans l'immédiat après-guerre avec ta naissance de la cybernétique. Ce "" paradigme cybernétique "", dont l'apparition est historiquement datée se fondait sur une toute nouvelle conception de l'humain et de la société en rupture avec l'héritage humaniste de la modernité. En général ignorée, ou passée sous silence, cette influence a profondément marqué le paysage intellectuel contemporain. C'est ce que l'auteur de ce livre, sociologue à l'université de Montréal, met en évidence dans cet essai. Il s'agit de reconstituer, avec précision, la généalogie d'un paradigme qui fut et demeure trés influent aussi bien sur le vieux continent qu outre-Atlantique. A ce titre, le travail de Céline Lafontaine apparaît comme une contribution essentielle autant que neuve au débat contemporain. En replaçant dans son contexte historique l'apparition de ce qu'on appelle la postmociernité, cet essai surprendra sans doute. C'est néanmoins un apport dont il sera désormais difficile de ne pas tenir compte, d'autant plus qu'il apporte un éclairage neuf sur l'imaginaire des technosciences.",Cybernetics,
728,9782744064173,"La semaine de 4 heures : travaillez moins, gagnez plus et vivez mieux ! /",,,,,,,,,,
729,2081375125,Pensées pour soi /,,,,,,,,,,
730,9782900818237,Comment être parfait : les réponses aux questions éthiques que vous vous posez (et aux autres) /,,,,,,,,,,
731,9782807302532,Psychopathologie,Une approche intégrative,"David H Barlow, V Mark Durand, Michel Gottschalk",2016-06-24,803.0,MATURE,fr,,"Cet ouvrage présente une synthèse claire, précise et méthodique des connaissances les plus récentes en psychopathologie. Il intègre les dernières avancées du DSM 5! Intégrant les perspectives biologiques, psychologiques, sociales et culturelles, l'approche intégrative révolutionnaire de David Barlow et Mark V. Durand est la méthode la plus moderne et scientifiquement la mieux validée de l'étude, la recherche et la compréhension de la psychopathologie. Ce texte est la ressource disponible actuellement la plus complète d'apprentissage et de mise à jour des connaissances cliniques du praticien.",Affective disorders,http://books.google.com/books/content?id=UE7HDgAAQBAJ&printsec=frontcover&img=1&zoom=1&edge=curl&source=gbs_api
732,9782491260156,Politiser le bien-être,,Camille Teste,2023-04-12,0.0,NOT_MATURE,fr,,,,
733,9782757840214,L'homme qui prenait sa femme pour un chapeau,Et autres récits cliniques,Oliver Sacks,2014,312.0,NOT_MATURE,fr,,"L'homme qui prenait sa femme pour un chapeau Olivier Sacks décrit dans ce livre les affections les plus bizarres, celles qui atteignent l'homme non seulement dans son corps, mais dans sa personnalité la plus intime et dans l'image qu'il a de lui-même. Il nous fait pénétrer dans un royaume fantastique, peuplé de créatures étranges : un marin qui, ayant perdu la notion du temps, vit prisonnier d'un instant perpétuel ; un homme qui se prend pour un chien et renifle l'odeur du monde ; un musicien qui prend pour un chapeau la tête de sa femme, et bien d'autres... Tentatives aussi pour poser les jalons d'une médecine nouvelle, plus complète, qui, traitant le corps, ne refuserait pas de s'occuper de l'esprit, et même de l'âme.",Fiction,http://books.google.com/books/content?id=vR8vngEACAAJ&printsec=frontcover&img=1&zoom=1&source=gbs_api
734,2021495590,Voyage au bout de l'enfance,,Rachid Benzine,2022-01-07,79.0,NOT_MATURE,fr,,"« Trois mois. D'après maman, ça fait précisément trois mois aujourd'hui qu'on est enterrés dans ce fichu camp. Et ça fait presque quatre ans que j'ai quitté l'école Jacques-Prévert de Sarcelles. » R. B. Fabien est un petit garçon heureux qui aime, le football, la poésie et ses copains, jusqu'au jour où ses parents rejoignent la Syrie. Ce roman poignant et d'une grande humanité raconte le cauchemar éveillé d'un enfant lucide, courageux et aimant qui va affronter l'horreur.",,http://books.google.com/books/content?id=JcTjzgEACAAJ&printsec=frontcover&img=1&zoom=1&source=gbs_api
